Title,Year,Director,Runtime,Series,Tags,Country,Meta,Link,Show,Description,Theater,Scrape_Datetime
DO THE RIGHT THING,1989,Spike Lee,120,Scorchers,4K Digital Restoration,USA,"In English and Italian, Spanish and Korean with English subtitles | Format: 4K Digital Restoration",https://www.siskelfilmcenter.org//do-right-thing,DO THE RIGHT THING,"It’s the hottest day of the year in Brooklyn’s Bedford-Stuyvesant neighborhood, and pizza delivery man Mookie (Spike Lee) is working for Sal (Danny Aiello), the Italian-American owner of a pizzeria in the predominantly Black community. The residents of the neighborhood—including boombox-blasting Radio Raheem (Bill Nunn), activist Buggin’ Out (Giancarlo Esposito), and Korean shopkeeper Sonny (Steve Park)—coexist tenuously, until a dispute over the pizzeria’s “Wall of Fame”—which showcases famous Italian-Americans, but no Black celebrities—ignites a violent chain of events that ends in tragedy. Lee’s magnum opus is blistering commentary on race, police brutality, and justice, and burns timelessly as one of the most significant films of the 20th century.",Siskel,2025-07-16T16:10:47.721576+00:00
CRIMSON GOLD,2003,Jafar Panahi,95,The Chicago International Film Festival Presents: The (Usual) Auteur Suspects,,Iran,In Persian with English subtitles | Format: Digital,https://www.siskelfilmcenter.org//crimson-gold,CRIMSON GOLD,"In this blistering, slow-burn thriller from acclaimed director Jafar Panahi (OFFSIDE, THIS IS NOT A FILM, TAXI), and written by his compatriot Abbas Kiarostami, a pizza delivery driver and war veteran drives around the city on his moped, bearing witness to Tehran’s deep class divide. After being humiliated when a jewelry shop owner won’t allow him into his store, the man is eventually pushed to the brink. Winner of the top prize at the 2003 Chicago International Film Festival, CRIMSON GOLD has been called an Iranian TAXI DRIVER—an unsettling neorealist critique of a repressive society and the tragic fate of those individuals left in its uncaring wake.",Siskel,2025-07-16T16:10:47.721576+00:00
THE PLAYER,1994,Robert Altman,124,Robert Altman Centennial,,USA,In English | Format: Digital,https://www.siskelfilmcenter.org//player,THE PLAYER,"In Altman’s slick and stylish THE PLAYER, morally dubious Hollywood producer Griffin Mill (Tim Robbins) is on edge after receiving death threats from a rejected screenwriter. When his meeting with the suspected sender leads to a deadly confrontation, Griffin is entangled in a web of paranoia and lies. With an all-star cast including Peter Gallagher, Whoopi Goldberg, and Fred Ward, and celebrity cameos from Harry Belafonte, Anjelica Huston, Marlee Matlin, and Burt Reynolds, among others, THE PLAYER—which begins with an astonishing, eight-minute, single-take opening shot—earned Altman his third Academy Award nomination for Best Director. A biting critique of the commodification of creativity, Altman explained THE PLAYER bites even deeper: “People say this is a satire, and it's an attack on Hollywood. It isn’t. I’m using Hollywood and the film business as a metaphor for our culture and our country… talking about greed and who we admire.”",Siskel,2025-07-16T16:10:47.721576+00:00
TIME AND TIDE,2000,Hark Tsui,113,,35mm,Hong Kong/China,"In English and Mandarin, Hokkien, Cantonese, and Portuguese with English subtitles | Format: 35mm",https://www.siskelfilmcenter.org//time-and-tide,Chicago Film Society Presents: TIME AND TIDE,"Fresh off a disappointing stint in Hollywood, where he’d made two great (but underperforming) Jean-Claude Van Damme action flicks, the prolific Tsui Hark returned to Hong Kong ready to reimagine his filmmaking and what contemporary cinema could be. The result was TIME AND TIDE, Tsui’s celebration of renewal and birth. In the film, Tyler Yim (Nicholas Tse), a naïve young man on the precipice of a new career as a bodyguard, attempts to embrace unexpected fatherhood. Nine months after the drunken tryst that changed his life, he befriends Jack (Wu Bai), an assassin and fellow father-to-be, though they eventually end up on opposite sides of an all-out gang war.",Siskel,2025-07-16T16:10:47.721576+00:00
STRAY DOG,1949,Akira Kurosawa,122,Scorchers,35mm,Japan,In Japanese and French with English subtitles | Format: 35mm,https://www.siskelfilmcenter.org//stray-dog,STRAY DOG,"Dog days indeed. Akira Kurosawa’s magnificent STRAY DOGS begins with a close up of a panting dog, and the opening line: “It was an unbearably hot day.” In post-World War II Tokyo, in the middle of a heatwave, rookie detective Murakami (Toshirô Mifune) has his pistol stolen on the bus. When it is used in a robbery, he is paired with veteran detective Satō (Takashi Shimura) to track down the thief. Electric fans whir, linen suits are soaked with sweat, and the exhaustion on everyone’s faces is not just from the heat, but from the trauma of war. As he gets ever closer to his gun, Murakami’s guilt over its loss, and his desire to see the good in everyone—even criminals—forces him to decide what kind of detective he really is.",Siskel,2025-07-16T16:10:47.721576+00:00
PRESENT LAUGHTER,2024,Matthew Warchus,180,National Theatre Live,,UK,In English | Format: Digital,https://www.siskelfilmcenter.org//present-laughter,National Theatre Live: PRESENT LAUGHTER,"The multi-award-winning production of Noël Coward’s provocative comedy featuring Andrew Scott (Fleabag, National Theatre Live’s VANYA) returns to the big screen. As he prepares to embark on an overseas tour, star actor Garry Essendine’s colorful life is in danger of spiraling out of control. Engulfed by an escalating identity crisis as his many and various relationships compete for his attention, Garry’s few remaining days at home are a chaotic whirlwind of love, sex, panic, and soul-searching. (NTL)",Siskel,2025-07-16T16:10:47.721576+00:00
THE BRIDGE ON THE RIVER KWAI,1957,David Lean,161,Scorchers,4K Digital Restoration,UK/USA,In English and Japanese and Thai with English subtitles | Format: 4K digital restoration,https://www.siskelfilmcenter.org//bridge-river-kwai,THE BRIDGE ON THE RIVER KWAI,"At a sweltering WWII Japanese prison camp, British POWs, led by the principled Colonel Nicholson (Alec Guinness, in an Academy Award–winning performance), are forced to build a railway bridge in Burma, a project overseen by Colonel Saito (the singular Sessue Hayakawa). Nicholson sees the construction as a way to maintain morale; if Saito does not complete the bridge, his honor will be shattered. Both men become obsessed with the project. Meanwhile, Allied forces, led by the Navy Commander Shears (William Holden), an escapee of the camp, plan a mission to destroy the bridge. Set in the unforgiving jungle, where nature takes no pity on the folly of man, David Lean’s Academy Award winner for Best Picture is a masterful anti-war epic, a portrait of duty and pride, and a battle between three men with a stunning climax that will have you sweating in your seat.",Siskel,2025-07-16T16:10:47.721576+00:00
Chicago Palestine Film Festival Short Films Event,2021,Various directors,55,,,Palestine,In English and Arabic with English subtitles | Format: Digital,https://www.siskelfilmcenter.org//cpff-shorts-event,Chicago Palestine Film Festival Short Films Event,"In SIRI MIRI (2021, dir. Luay Awwad, 6 min., in English and Arabic with English subtitles, pictured), two Palestinian teens, out of boredom and sick of their mundane routine that’s leading them nowhere in life, ask Siri for help. Will it work?",Siskel,2025-07-16T16:10:47.721576+00:00
TRANSIT,2018,Christian Petzold,101,The Chicago International Film Festival Presents: The (Usual) Auteur Suspects,,Germany/France,"In German, French, and French Sign Language with English subtitles | Format: Digital",https://www.siskelfilmcenter.org//transit,TRANSIT,"A mainstay of the international festival circuit, Christian Petzold (BARBARA, AFIRE) crafts this cinematic puzzle box that premiered at the Festival in 2018. Elusive, prescient, and exquisitely made, this trenchant exploration of the plight of refugees feels even more timely than when it first premiered. After a fascist invasion of France, Georg (PASSAGES’ Franz Rogowski) assumes the identity of a dead author in order to flee to Mexico. As he waits for passage, he becomes trapped in the port city of Marseilles in the company of others desperate to escape. While in limbo, he encounters a woman searching for her missing husband—the man whose identity he has assumed.",Siskel,2025-07-16T16:10:47.721576+00:00
SHORT CUTS,1993,Robert Altman,188,Robert Altman Centennial,35mm,USA,In English | Format: 35mm,https://www.siskelfilmcenter.org//short-cuts,SHORT CUTS,"In the night sky, helicopters circle and spray, raining insecticide indiscriminately over Los Angeles residents. We meet 23 of them—portrayed by Matthew Modine, Julianne Moore, Fred Ward, Anne Archer, Jennifer Jason Leigh, Robert Downey Jr., Lili Taylor, Madeleine Stowe, Chris Penn, Jack Lemmon, Frances McDormand, Tim Robbins, Lori Singer, Peter Gallagher, Andie MacDowell, Buck Henry, Zane Cassidy, Lily Tomlin, Annie Ross, Bruce Davidson, Huey Lewis, Lyle Lovett, and Tom Waits—whose lives intersect over the course of a weekend. Adapted from the stories of Raymond Carver, SHORT CUTS is a grand vision that, like Los Angeles, sprawls: across marriages, sex, death, and hope. Epic in scale but abundant with moments of intimacy, SHORT CUTS, for which Altman received his fourth Academy Award nomination for Best Director, is an unforgettable portrait of the beauty and chaos of everyday life. 35mm print courtesy of the Robert Altman Collection at the UCLA Film & Television Archive.",Siskel,2025-07-16T16:10:47.721576+00:00
"THE GOOD, THE BAD, AND THE UGLY",1966,Sergio Leone,178,Scorchers,4K Digital Restoration,Italy/Spain/West Germany/USA,In English and Italian with English subtitles | Format: 4K digital restoration,https://www.siskelfilmcenter.org//good-bad-and-ugly,"THE GOOD, THE BAD, AND THE UGLY","Set in the sun-drenched Southwest during the Civil War, two men—an unnamed drifter (Clint Eastwood) and the bandit Tuco (Eli Wallach)—form an uneasy alliance after they learn that $200,000 is hidden in an unmarked grave. As Tuco knows the cemetery location, and the drifter knows which grave holds the cache, the two set out across war zones to find and share the reward. Meanwhile, the criminal Setenza (Lee Van Cleef) is on his own hunt for the cash and will do anything to claim it for himself. Sergio Leone’s operatic masterpiece, set to Ennio Morricone’s iconic score, dismantles audiences ideas of the romantic western; this is an unforgiving landscape where there is no John Wayne coming to save the day, and even if you survive the final standoff (and what a standoff it is!), you don’t ride off into the sunset, but under a blazingly hot sun.",Siskel,2025-07-16T16:10:47.721576+00:00
SEXY BEAST,2000,Jonathan Glazer,89,Scorchers,35mm,UK/Spain,In English and Spanish with English subtitles | Format: 35mm,https://www.siskelfilmcenter.org//sexy-beast,SEXY BEAST,"At the start of Jonathan Glazer’s (ZONE OF INTEREST) knockout feature film debut, ex-criminal Gal (Ray Winstone) blissfully bakes under the sun at his Costa del Sol villa (“I’m roasting. Boiling. Baking. Sweltering...,” he murmurs). Happily retired, Gal and his wife’s languid life is shattered by the arrival of the psychotic gangster Don Logan (Ben Kingsley, in an electrifying, Academy Award–nominated performance), who is intent on persuading Gal to do one more big job. Reticent to return to a life of crime, Gal is given little choice to refuse Don without dire consequences. A slick and stylish crime caper, SEXY BEAST is also a red hot thriller that threatens to boil over at any minute. This tense, taut tour de force doesn’t waste a second before it starts turning up the heat.",Siskel,2025-07-16T16:10:47.721576+00:00
BLACK HARVEST PRESENTS: MAHOGANY AT 50 — INVISIBLE BEAUTY,2023,"Bethann Hardison, Frédéric Tcheng",115,,Director and Subject In Attendance,USA,In English and Spanish with English subtitles | Format: Digital,https://www.siskelfilmcenter.org//invisible-beauty,BLACK HARVEST PRESENTS: MAHOGANY AT 50 — INVISIBLE BEAUTY,"In this absorbing record, fashion revolutionary Bethann Hardison looks back on her journey as a pioneering Black model, modeling agent, and activist, shining a light on an untold chapter in the fight for racial diversity. From walking runway shows alongside Iman to discovering and mentoring models like Naomi Campbell, Hardison has been at the epicenter of major representational shifts in fashion. Catalyzing change requires continuous championing, and as the next generation takes the reins, Hardison reflects on her personal journey and the cost of being a pioneer. Presented as part of the city-wide, 50th anniversary of the film MAHOGANY, and presented in collaboration with the Mahogany at 50 Committee. Learn more at mahoganyat50.com. Dialogue: Director and subject Bethann Hardison in attendance.",Siskel,2025-07-16T16:10:47.721576+00:00
INHERIT THE WIND,1960,Stanley Kramer,128,Scorchers,,USA,In English | Format: Digital,https://www.siskelfilmcenter.org//inherit-wind,INHERIT THE WIND,"Though based on the real-life 1925 Scopes Trial and made 65 years ago, INHERIT THE WIND might as well have been made this year; it is that eerily prescient. When Tennessee teacher Bertram Cates is put on trial for teaching evolution instead of creationism, he is defended in a sweltering courtroom by Chicago lawyer and atheist Henry Drummond (Spencer Tracy), against a prosecution team that includes Biblical scholar and zealot Matthew Brady (Fredric March). As the public gallery fans themselves (“I’ll pack my bags and go back to Chicago where it’s a nice, cool 100 degrees in the shade,” Drummond quips), a masterful verbal sparring match about ignorance fueled by religious righteousness plays out. Capturing it all is reporter E.K Hornbeck (Gene Kelly), adding to the feeling that, if it weren’t for the suspenders and the lack of air conditioning, INHERIT THE WIND could be a 2025 new release coming to a theater near you.",Siskel,2025-07-16T16:10:47.721576+00:00
LA PISCINE,1969,Jacques Deray,122,Scorchers,4K Digital Restoration,France/Italy,In English and French with English subtitles | Format: 4K digital restoration,https://www.siskelfilmcenter.org//la-piscine,LA PISCINE,"In Jacques Deray’s infamously sultry LA PISCINE, lovers Jean-Paul (Alain Delon) and Marianne (Romy Schneider) lounge poolside at a luxurious villa in the south of France, soaking up the summer sun and taking breaks only to cool down with a swim (or turn up the heat with alfresco lovemaking). When their friend Harry (Maurice Ronet) and his daughter Penelope (Jane Birkin) come to visit, old rivalries return and new attractions spark, and the once placid and pleasurable summer becomes a turbulent and tense reunion. In addition to the scorching sun, Delon and Schneider, once a couple in real life (so beautiful a pair, they were nicknamed “the magnificent lovers”) saturate the film with their white hot, crackling chemistry. By the time LA PISCINE’s desperate third act arrives, no level of SPF can protect the foursome.",Siskel,2025-07-16T16:10:47.721576+00:00
COOL HAND LUKE,1967,Stuart Rosenberg,127,Scorchers,4K Digital Restoration,USA,In English | Format: 4K digital restoration,https://www.siskelfilmcenter.org//cool-hand-luke,COOL HAND LUKE,"Luke Johnson (Paul Newman, the definition of “sizzling”) is sentenced to a Florida chain gang after a drunken act of petty vandalism. Luke refuses to conform to the prison’s authoritarian leadership, which makes him a target of the warden and rifleman, and his defiance puts him at odds with top dog prisoner Dragline (George Kennedy, in an Academy Award–winning performance), until a sweat-soaked, knock- down, drag-out fight between the two earns Luke Dragline’s admiration and respect. Tenacious and resilient, Luke challenges the boundaries of what is expected of him as a prisoner and fellow inmate, turning him into a symbol of resistance against oppressive authority, and a hero within the gang. Shirts stick to sweaty backs and the unrelenting heat and abuse weighs heavily on the captive men, even the seemingly unbreakable Cool Hand Luke, in this classic and devastating story of hope and heroes.",Siskel,2025-07-16T16:10:47.721576+00:00
NIGHT MOVES,2013,Kelly Reichardt,112,The Chicago International Film Festival Presents: The (Usual) Auteur Suspects,,USA,In English | Format: Digital,https://www.siskelfilmcenter.org//night-moves,NIGHT MOVES,"In recent work, including CERTAIN WOMEN, FIRST COW, and SHOWING UP, filmmaker Kelly Reichardt has expanded on the impeccable craft demonstrated in her early masterpieces OLD JOY and WENDY AND LUCY with the same careful and patient attention to American landscape and character. In her fourth feature, Reichardt’s pensive spin on the heist genre revolves around three radical eco-activists (played by Jesse Eisenberg, Dakota Fanning, and Peter Sarsgaard), who conspire to blow up a dam. Boasting a showstopping, nerve-racking centerpiece, the film is a probing look at the psychological consequences of political action and the tensions between peaceful personal ideology and violent, declarative protest.",Siskel,2025-07-16T16:10:47.721576+00:00
GOSFORD PARK,2001,Robert Altman,137,Robert Altman Centennial,,UK/Italy/USA,In English and Latin with English subtitles | Format: Digital,https://www.siskelfilmcenter.org//gosford-park,GOSFORD PARK,"Step aside, Agatha Christie. Julian Fellows’ (later of Downton Abbey fame) delicious dissection of the British class structure is brought to lavish life in Altman’s late career whodunit. Set in 1930s England, a group of aristocrats (Kristin Scott Thomas, Michael Gambon, Tom Hollander, Maggie Smith) gather at a grand estate for a weekend of hunting, as their maids, butlers, and valets (Hellen Mirren, Clive Owen, Kelly Macdonald, Emily Watson) assemble to serve them. Simmering tensions, clandestine conversations, and multi-course dinners are disrupted when a member of the ruling class is murdered (twice!), and everyone—both upstairs and down—is a suspect. Garnering Altman his fifth Best Director Academy Award nomination, a nomination for Best Picture, and a Best Original Screenplay win for Fellows (as well as Best Supporting Actress noms for both Smith and Mirren), GOSFORD PARK proved that no one can do “Altmanesque” better than Altman.",Siskel,2025-07-16T16:10:47.721576+00:00
THE BIRDS,1963,Alfred Hitchcock,119,Chicago Film Society: Technicolor Weekend,35mm,USA,In English | Format: 35mm from private collection,https://www.siskelfilmcenter.org//birds,THE BIRDS,"Alfred Hitchcock’s late classic could’ve been a wholesome pet store meet cute between Rod Taylor and Tippi Hedren, but it unravels into an apocalyptic nightmare as their Sonoma County idyll is swarmed by thousands of birds who descend on the town like locusts only bigger, louder, and more bloodthirsty. THE BIRDS spares no child, adult, updo, or body part from the feathered freaks raining down from the sky. With over 350 special effects shots combining live birds, mechanical birds, and the sodium vapor process, this Technicolor print just might pluck your eyes out! (Tavi Veraldi)",Siskel,2025-07-16T16:10:47.721576+00:00
BLACK BELT JONES,1974,Robert Clouse,87,Chicago Film Society: Technicolor Weekend,35mm,USA,In English | Format: 35mm from private collection,https://www.siskelfilmcenter.org//black-belt-jones,BLACK BELT JONES,"In this heated Blaxploitation flick, Black Belt Jones (Jim “Dragon” Kelly) takes on the mob to stop them from seizing the karate dojo run by his friend Pops (Scatman Crothers). Coming hot off his role alongside Bruce Lee in ENTER THE DRAGON, Kelly exudes confidence, Black power, and an indecent number of one-liners that will equip you to annoy your friends long after you leave the theater. In addition to being a great entertainer, Kelly was a trained martial artist, with at least one international karate title under his black belt before his acting debut. This slice of Blaxploitation history is not to be missed, ya dig? (Tavi Veraldi)",Siskel,2025-07-16T16:10:47.721576+00:00
LILI,1953,Charles Walters,81,Chicago Film Society: Technicolor Weekend,35mm,USA,In English | Format: 35mm from Chicago Film Society,https://www.siskelfilmcenter.org//lili,LILI,"Five years before GIGI, Leslie Caron starred as Lili, a happy-go-lucky French lass surrounded by lecherous men (and impressively crafted puppets) in Charles Walters’s largely forgotten, winsomely kooky MGM musical. Lili doggedly pursues a manipulative magician (Mel Ferrer), eventually lands a decent job at the carnival, and finds her niche in the troupe after her colleagues discover her earnestly conversing with the puppets as though they’re her friends (she cares quite deeply for them). Screenwriter Helen Deutsch was nominated for an Academy Award for her script; she later pitched the concept to Broadway, where it became the stage musical Carnival! (Rocío Irizarry Nuñez)",Siskel,2025-07-16T16:10:47.721576+00:00
ARABESQUE,1966,Stanley Donen,105,Chicago Film Society: Technicolor Weekend,35mm,USA,In English | Format: 35mm from Chicago Film Society,https://www.siskelfilmcenter.org//arabesque,ARABESQUE,"On the heels of the Cary Grant showpiece Charade, Universal Pictures and choreographer-turned-director Stanley Donen looked to replicate their success with another frothy continental romance-caper. Gregory Peck was cast as a kidnapped hieroglyphics expert with Sophia Loren as the woman who helps him escape certain death; their enthusiasm for the project carried the film into production, despite Donen’s growing distaste for its script. Rather than attempt to rein in its jumbled intrigues and inscrutable motivations, Donen opted to focus on the film’s visual design, bringing a dazzling and experimental flamboyance to action set pieces (including a bonkers LSD-addled bicycle chase and a deadly showdown during an optometry appointment) and otherwise-rote exposition alike. (Cameron Worden)",Siskel,2025-07-16T16:10:47.721576+00:00
THE PARALLAX VIEW,1974,Alan J. Pakula,102,Chicago Film Society: Technicolor Weekend,35mm,USA,In English | Format: 35mm from the Wisconsin Center for Film and Theater Research,https://www.siskelfilmcenter.org//parallax-view,THE PARALLAX VIEW,"“There will be no questions.” In this tense and scrambling film, a headstrong news reporter (Warren Beatty) quixotically struggles to expose a sinister Kennedy-style assassination conspiracy. Alan J. Pakula’s second collaboration with legendary lensman Gordon Willis (KLUTE, THE GODFATHER) wedded the burgeoning genre of “American political thriller” to a severe, Antonioni-ish sense of scale, composition, and color—Beatty and other puny humans are frequently dwarfed by pale, unfeeling cityscapes and gargantuan modernist architecture in vibrant primary hues. Among the film’s other monuments: a small, stirring performance from the great Paula Prentiss that serves as the story’s emotional linchpin. (Gabriel Wallace)",Siskel,2025-07-16T16:10:47.721576+00:00
THE DISORDERLY ORDERLY,1964,Frank Tashlin,90,Chicago Film Society: Technicolor Weekend,35mm,USA,In English | Format: 35mm from private collection,https://www.siskelfilmcenter.org//disorderly-orderly,THE DISORDERLY ORDERLY,"It’s Jerry Lewis and he works in a sanitarium. What more do you need to know? Frank Tashlin, directing the Maestro for the eighth and final time, delivers a blistering cavalcade of visual gags, aural puns, and hospital slapstick, with his signature cartoon-bred flourishes that (arguably) propel Lewis’s manic schticking to the level of High American Pop. The film occasionally explodes with garish chromatic touches as though it’s moonlighting as a test film for the Technicolor process itself. We must also single out for praise the title song, surely one of filmdom’s most bizarre, which is hauntingly crooned over the opening credits by Sammy Davis, Jr. Don’t find a gag funny? Just wait a couple seconds, there’ll be another one along soon. (Gabriel Wallace)",Siskel,2025-07-16T16:10:47.721576+00:00
MARY POPPINS,1964,Robert Stevenson,139,Chicago Film Society: Technicolor Weekend,35mm,USA,In English | Format: 35mm from the Chicago Film Society collection at the University of Chicago Film Studies Center,https://www.siskelfilmcenter.org//mary-poppins,MARY POPPINS,"Walt Disney spent years trying to convince author P. L. Travers to let him make a film of Mary Poppins, finally securing her permission with the stipulation that she would be a consultant on the production. The result is an astonishing blend of live action, animation, early animatronics, painted backgrounds, and myriad other practical effects. Beloved for its beautiful Sherman Brothers songs, the incredible performances of Julie Andrews and Dick Van Dyke, and its 14-minute chimney sweep dance sequence, MARY POPPINS may also be more timely than ever, a film which advocates for charity, humility, laughter, and common sense in a world which increasingly lacks all of these things. (Julian Antos)",Siskel,2025-07-16T16:10:47.721576+00:00
