Title Searched,Year Searched,Director Searched,Publication,Score,Critic,Snippet,Date Written
ERIC LARUE,2024,Michael Shannon,The Playlist,67,Marshall Shaffer,"Shannon’s first feature might begin to sag under the weight of this stilted dialogue and stunted duration, but there is still a lot to admire in Eric Larue. Those qualities are not necessarily all concentrated in Judy Greer, either. Even if the film moves in circles, at least it’s circling something honest and true about spirituality and society alike.","Jun 12, 2023"
ERIC LARUE,2024,Michael Shannon,LarsenOnFilm,63,Josh Larsen,"At its best, Eric LaRue interrogates the rush to healing and forgiveness that can sometimes follow tragedy in Christian communities.","Apr 2, 2025"
ERIC LARUE,2024,Michael Shannon,The A.V. Club,58,Brianna Zigler,"Though carried by a subtle and strenuous performance from Greer, Eric LaRue‘s intentionally unanswered questions do less to provoke than render the film a collage of well-meaning, half-finished sentiments.","Apr 2, 2025"
ERIC LARUE,2024,Michael Shannon,Collider,50,Taylor Gates,"There are several interesting ideas and stories floating around Eric LaRue, but Shannon can’t seem to decide which ones to focus on. While there are some genuinely fantastic, inspired moments, they frustratingly never quite come together, leading to a baffling viewing experience. Hopefully, Greer will get another chance in the spotlight of a more worthy film.","Jun 15, 2023"
ERIC LARUE,2024,Michael Shannon,Slant Magazine,50,Pat Brown,"While the film features a strong performance from Judy Greer, it’s essentially a patchwork of broad strokes that rarely feel like they’re bringing its world to credible life.","Apr 1, 2025"
MISHIMA: A LIFE IN FOUR CHAPTERS,1985,Paul Schrader,Chicago Sun-Times,100,Roger Ebert,"The most unconventional biopic I've ever seen, and one of the best.",
MISHIMA: A LIFE IN FOUR CHAPTERS,1985,Paul Schrader,The A.V. Club,100,Nathan Rabin,"Calling Schrader's masterpiece a mere biopic doesn't do it justice. It's more a dreamy, hypnotic meditation on the tragic intersection of Mishima's oeuvre and existence that takes place as much in its subject's fevered imagination as the outside world.",
MISHIMA: A LIFE IN FOUR CHAPTERS,1985,Paul Schrader,Variety,100,Peter Debruge,"Beautiful, yet flawed film.",
MISHIMA: A LIFE IN FOUR CHAPTERS,1985,Paul Schrader,Time Out,100,Tom Huddleston,"Graced with a throbbing orchestral score from Philip Glass and John Bailey’s luminous photography, this is appropriately monumental filmmaking.",
MISHIMA: A LIFE IN FOUR CHAPTERS,1985,Paul Schrader,The New Yorker,100,Michael Sragow,One of the most gorgeous and sophisticated portraits of an artist ever put on film.,
MISHIMA: A LIFE IN FOUR CHAPTERS,1985,Paul Schrader,Chicago Tribune,100,Gene Siskel,"One of the year`s boldest, most successful films, a film full of ideas that challenges us to examine how we conduct our lives, while at the same time dazzling us with extraordinary visuals.",
MISHIMA: A LIFE IN FOUR CHAPTERS,1985,Paul Schrader,The Globe and Mail (Toronto),100,Jay Scott,"Can a film that raises more questions about its subject than it answers be considered a masterpiece? If it can, that film is Paul Schrader's innovative cinematic biography of the Japanese novelist, essayist and actor Yukio Mishima, the man who in 1970 committed public seppuku (hara-kiri) in an unprecedented, grandiloquent attempt to turn his life into art. [12 Sep 1985]",
MISHIMA: A LIFE IN FOUR CHAPTERS,1985,Paul Schrader,Village Voice,90,Nick Pinkerton,"A sumptuous austerity, paralleling Mishima’s disciplined decadence.",
MISHIMA: A LIFE IN FOUR CHAPTERS,1985,Paul Schrader,The Guardian,80,Peter Bradshaw,"An ambitious, respectful account of the life and work of Yukio Mishima, the prolific Japanese author who made a romantic cult of Japan's lost world of martial glory and spartan warrior-manhood.",
MISHIMA: A LIFE IN FOUR CHAPTERS,1985,Paul Schrader,Los Angeles Times,80,Sheila Benson,"A beautiful, deadly serious attempt by Paul and Leonard Schrader to illuminate the life--and death--of one of Japan's most highly visible and self-propelling enigmas.",
MISHIMA: A LIFE IN FOUR CHAPTERS,1985,Paul Schrader,TV Guide Magazine,75,Staff (Not Credited),"Mishima's most stunning aspect is the visual style employed in the dramatizations of the novels. With colorful, theatrical sets by famed Japanese designer Eiko Ishioka, the sequences are quite unique and impressive in their own right, and the entire film is photographed beautifully by John Bailey.",
MISHIMA: A LIFE IN FOUR CHAPTERS,1985,Paul Schrader,Newsweek,70,David Ansen,"This handsomely shot movie, with its throbbing Philip Glass score, has a kind of perverse integrity; its mixture of the art house and the hothouse is pure Schrader. I'm not sure whom this movie is made for, but you've got to admire the chutzpah of the man who got it made. [23 Sep 1985, p.68]",
MISHIMA: A LIFE IN FOUR CHAPTERS,1985,Paul Schrader,The Telegraph,60,David Gritten,"There’s a coldness in Schrader’s calculations, and disturbingly he seems to swallow the entire myth of Mishima, an extreme right-wing nutjob who wanted to return Japan to samurai values. Philip Glass’s score, however, still takes the breath away.",
MISHIMA: A LIFE IN FOUR CHAPTERS,1985,Paul Schrader,The New York Times,50,Vincent Canby,"Here is an American film, in Japanese with English subtitles, written, directed and photographed by Americans, made in Japan with a Japanese cast, which attempts to reveal the spiritual mysteries of a quintessentially Japanese phenomenon. That it doesn't succeed is almost a foregone conclusion. What is surprising, however, is that Mishima is as tolerable as it is, given all the strikes against it.",
MISHIMA: A LIFE IN FOUR CHAPTERS,1985,Paul Schrader,Washington Post,50,Paul Attanasio,"Mishima tries to make sense of both its subject's life and his work, and ends up illuminating neither.",
AMERICAN GIGOLO,1980,Paul Schrader,Chicago Sun-Times,88,Roger Ebert,The whole movie has a winning sadness about it; take away the story's sensational aspects and what you have is a study in loneliness.,
AMERICAN GIGOLO,1980,Paul Schrader,The Globe and Mail (Toronto),88,Jay Scott,An inspired variation on his familiar theme: the whore with a heart of gold is a man. [2 Feb 1980],
AMERICAN GIGOLO,1980,Paul Schrader,TV Guide Magazine,75,Staff (Not Credited),"Abandoning the gritty realism of his first two films, BLUE COLLAR and HARDCORE, screenwriter-turned-director Schrader here adopted a sleek and stylish approach. The result was one of his most satisfying attempts to mesh a European sensibility and his own obsession with moral drift and emotional alienation.",
AMERICAN GIGOLO,1980,Paul Schrader,Time Out London,50,Staff (Not Credited),"Unfortunately, the film is so determinedly stylish (Gere's costumes, Giorgio Moroder's soundtrack, John Bailey's noir-inflected camerawork), and the performances generally so vacuous (only Elizondo's detective really breathes), that it all becomes something of an academic, if entertaining, exercise that fails to stir the emotions.",
AMERICAN GIGOLO,1980,Paul Schrader,Variety,40,Staff (Not Credited),"A hot subject, cool style and overly contrived plotting don’t all mesh in American Gigolo. Paul Schrader’s third outing as a director is betrayed by a curious, uncharacteristic evasiveness at its core.",
AMERICAN GIGOLO,1980,Paul Schrader,Washington Post,40,Judith Martin,"This is basically a story about the pastime of shopping as an antidote to boredom, only the shopper has wandered into a cocktail lounge, instead of a store, and is looking for something live, or nearly so, to try on. That any human activity worth considering should ensue from this situation would be ridiculous to expect. [8 Feb 1980, p.20]",
AMERICAN GIGOLO,1980,Paul Schrader,Time,40,Richard Schickel,"Schrader's development of the frame-up story is mechanically melodramatic, and Gere, essentially a boring actor, doesn't help much either. He just cannot carry a picture, even when his passivity and gentleness well serve some aspects of his character, as they do here.",
AMERICAN GIGOLO,1980,Paul Schrader,Newsweek,30,David Ansen,"Though it tells us that it's about a man who gives pleasure for a living but is incapable of accepting pleasure, it is in fact about the guilty obsessions of a filmmaker who seems incapable of giving pleasure to an audience. [11 Feb 1980, p.82]",
GRAND TOUR,2024,Miguel Gomes,The New York Times,100,Natalia Winkelman,"Beauty is pleasurable, but the film’s use of evocative visuals to focus on storytelling more broadly is what makes it a quiet knockout.","Mar 27, 2025"
GRAND TOUR,2024,Miguel Gomes,Los Angeles Times,100,Tim Grierson,"The characters’ dilemma may, ultimately, be meaningless set against the ebbs and flows of history, but Gomes, who won the directing prize at last year’s Cannes Film Festival, invests it with such elegance that it becomes nearly mythic: a touching fable of cowardice and devotion with tragic undertones. The scenes may be dreamlike, but they’re our shared dream of being swept away by the movies.","Mar 28, 2025"
GRAND TOUR,2024,Miguel Gomes,The Film Stage,91,Rory O'Connor,"It all comes together beautifully, a film to stimulate curious corners of the mind and adventurous parts of the spirit.","May 27, 2024"
GRAND TOUR,2024,Miguel Gomes,Screen Daily,90,Jonathan Romney,"A hypnotic and inventive Asian odyssey ... The viewer may not know exactly where Gomes and his characters are headed, but the journey is pursued with wit, imagination and intelligence, and delivers oblique insights about the way we see the world and history.","May 22, 2024"
GRAND TOUR,2024,Miguel Gomes,Variety,90,Jessica Kiang,"But for anyone feeling a pessimism creeping in like slow poison and taking the edge off any appetite for adventure, Portuguese singularity Miguel Gomes comes like a comet across the Cannes competition with “Grand Tour,” an enchanting, enlivening, era-spanning, continent-crossing travelogue that runs the very serious risk of infecting you with the antidote: a potent dose of wanderlust-for-life.","May 22, 2024"
GRAND TOUR,2024,Miguel Gomes,New York Magazine (Vulture),90,Bilge Ebiri,"The film returns us to a childlike gaze, marveling at a world alive with possibility, where every sight lives on a continuum of meaning.","Oct 10, 2024"
GRAND TOUR,2024,Miguel Gomes,Slant Magazine,88,Brad Hanford,"If Tabu locates the colonial mindset in madness and obsession, Grand Tour does so in cowardice and obliviousness.","Oct 2, 2024"
GRAND TOUR,2024,Miguel Gomes,The A.V. Club,83,Alex Lei,"Gomes picks apart an imagined past by experiencing its present, at the same time sharply unpacking the screwball comedy by separating the running man and the pursuing woman.","Mar 26, 2025"
GRAND TOUR,2024,Miguel Gomes,The Guardian,80,Peter Bradshaw,"It is elegant, eccentric and needs some time to be indulged. ... And yes, it is six parts beguiling to one part exasperating. But ... it leaves you with a gentle, bemused smile on your face.","May 22, 2024"
GRAND TOUR,2024,Miguel Gomes,The Film Verdict,78,Deborah Young,"Gomes is a director poised between ironic narrative and experimentalism pure and simple, and his films (often described as strange, lyrical and hypnotizing) divide audiences into the visionaries and the unconvinced.","May 23, 2024"
GRAND TOUR,2024,Miguel Gomes,RogerEbert.com,75,Glenn Kenny,"Viewers looking for a tidy narrative and gratifying conclusions will come up short with this movie. But if you can roll with atmospherics that are their own reason for being, “Grand Tour” has plenty, and they’re all beautifully realized.","Mar 28, 2025"
GRAND TOUR,2024,Miguel Gomes,TheWrap,70,Chase Hutchinson,"It is a wholly uncompromising experience that dances with mirth and melancholy. Proving to be evocative in one moment and unrelentingly exhausting in the next, it’s as gorgeous to behold visually as it is hard to completely embrace thematically. And yet, if you abandon yourself to it by the end as one character says, you can catch glimpses of something spectacularly sublime in the vast journey that it takes on.","May 27, 2024"
GRAND TOUR,2024,Miguel Gomes,IndieWire,67,David Ehrlich,"But for all the luminous beauty of its images, ""Grand Tour"" sorely lacks a current strong enough to sustain the thoughts that flow between them, compelling as some of those thoughts may be.","May 22, 2024"
GRAND TOUR,2024,Miguel Gomes,The Hollywood Reporter,60,Jordan Mintzer,"Fans of Gomes’ breakthrough 2012 feature, Tabu, will find much to love here as well, and in terms of craft his latest offers some truly beguiling moments. But anyone looking for a good story, or characters to get hooked on, may find themselves admiring the scenery without ever relishing it.","May 22, 2024"
GRAND TOUR,2024,Miguel Gomes,Collider,60,Aidan Kelley,"The film does show that Gomes is capable of making an authentic period piece and a stunning documentary, but the attempt of trying to do both at the same time has led to an unusual experiment that will leave one scratching their head.","Jan 21, 2025"
THE MISSING PICTURE,2013,Rithy Panh,Time Out,100,Joshua Rothkopf,"Either via clay dolls or fragile flesh, the truth is unmissable—as is Panh’s film itself.","Mar 18, 2014"
THE MISSING PICTURE,2013,Rithy Panh,Village Voice,100,Stephanie Zacharek,"The Missing Picture is so immediate, so vital, it practically breathes. Not all memoirs need to exist. But the gentle urgency of Panh's story is right there in the filmmaking. This is a story that had to be told. Even in its stillness, it moves.","Mar 18, 2014"
THE MISSING PICTURE,2013,Rithy Panh,The New York Times,100,Manohla Dargis,The audacity of The Missing Picture — a brilliant documentary about a child who held on to life in Cambodia’s killing fields — is equaled only by its soulfulness.,"Mar 19, 2014"
THE MISSING PICTURE,2013,Rithy Panh,Washington Post,100,Michael O'Sullivan,"As haunting as it is haunted, The Missing Picture leaves viewers’ heads rattling with ghosts.","Apr 3, 2014"
THE MISSING PICTURE,2013,Rithy Panh,Philadelphia Inquirer,100,Steven Rea,"In his own profound and ingenious way, Panh has brought the pictures and the thoughts together again.","Apr 4, 2014"
THE MISSING PICTURE,2013,Rithy Panh,The A.V. Club,91,A.A. Dowd,"The Missing Picture might have felt academic, even coldly removed, were it not for its scathing narration, penned by Panh (with Christophe Bataille) and read by Randal Douc.","Mar 13, 2014"
THE MISSING PICTURE,2013,Rithy Panh,Los Angeles Times,90,Kenneth Turan,"The Missing Picture is personal and unexpected, a documentary that mixes media in an unusual way to very potent effect.","Oct 3, 2013"
THE MISSING PICTURE,2013,Rithy Panh,The Dissolve,90,Scott Tobias,"This film confirms that Panh approaches the past not as a historian, but as an artist, and an exceptionally vital one at that.","Mar 18, 2014"
THE MISSING PICTURE,2013,Rithy Panh,Wall Street Journal,90,Joe Morgenstern,"These miniatures magnify their subjects, and ennoble them. The picture is anguishing to see, but it isn't missing anymore.","Mar 20, 2014"
THE MISSING PICTURE,2013,Rithy Panh,New York Post,88,Farran Smith Nehme,"Panh’s technique achieves things a conventional documentary could not, as when he pans across dozens of the clay figures jumbled in a box, in a shot that calls up both the toys of childhood, and graves.","Mar 20, 2014"
THE MISSING PICTURE,2013,Rithy Panh,Boston Globe,88,Peter Keough,His film aspires to a poetry about barbarism that will not let us forget.,"Apr 3, 2014"
THE MISSING PICTURE,2013,Rithy Panh,Portland Oregonian,83,Marc Mohan,"The Missing Picture feels akin to last year's great documentary, ""The Act of Killing.""","Apr 16, 2014"
THE MISSING PICTURE,2013,Rithy Panh,Variety,80,Justin Chang,"The film is a brave act of witness complicated by the documaker’s decision to re-create his experiences using clay figurines, a tricky aesthetic device that raises fascinating and problematic questions of representation.","Oct 3, 2013"
THE MISSING PICTURE,2013,Rithy Panh,Time Out London,80,Trevor Johnston,"The effect is talismanic: overlaid by a thoughtful voiceover, it invites the audience to share the pain in a cathartic act of imaginative reclamation.","Dec 17, 2013"
THE MISSING PICTURE,2013,Rithy Panh,Film.com,80,Jordan Hoffman,"A gripping, fascinating and visually arresting memoir.","Jan 1, 2014"
THE MISSING PICTURE,2013,Rithy Panh,Empire,80,David Parkinson,"Powerful and mesmerising, this offers an fresh approach to a tough topic.","Jan 1, 2014"
THE MISSING PICTURE,2013,Rithy Panh,Total Film,80,Philip Kemp,Panh’s commentary – spoken in French by Randal Douc – searingly sets the context.,"Jan 1, 2014"
THE MISSING PICTURE,2013,Rithy Panh,New York Daily News,80,Jordan Hoffman,This chronicle is impossible not to watch.,"Mar 20, 2014"
THE MISSING PICTURE,2013,Rithy Panh,Slant Magazine,75,Nick McCarthy,"Paramount to molding a narrative of war and totalitarianism, however, is the inventive aesthetic in which Panh frames his memoir: a hypnotic hybrid of bleak archival footage, thoughtful voiceover, tone-dictating music, and—most significantly—homemade clay-figurine dioramas.","Oct 3, 2013"
THE MISSING PICTURE,2013,Rithy Panh,The Playlist,75,Jessica Kiang,"If some elements are more successful than others in achieving a balance between the public and the private, between the story of a nation’s ruination and that of a family’s annihilation, it remains a shocking, poignant and soulful tribute to lives ended and to innocence lost in the country’s notorious Killing Fields.","Jan 29, 2014"
THE MISSING PICTURE,2013,Rithy Panh,Chicago Sun-Times,75,Bill Stamets,The Missing Picture is a wrenching yet tender memoir by Rithy Panh about life and death in the time of Pol Pot.,"Mar 13, 2014"
THE MISSING PICTURE,2013,Rithy Panh,RogerEbert.com,75,Christy Lemire,"As an examination of memory and experience and how they shape us, The Missing Picture is meaningful beyond its specific subject matter.","Mar 21, 2014"
THE MISSING PICTURE,2013,Rithy Panh,The Hollywood Reporter,70,Neil Young,A deliberately distanced but often harrowing vision of a living hell.,"Oct 3, 2013"
BOWLING FOR COLUMBINE,2002,Michael Moore,San Francisco Chronicle,100,Jonathan Curiel,Documentary reaches an exalted level of filmmaking. It explains the very fabric of American society.,
BOWLING FOR COLUMBINE,2002,Michael Moore,Chicago Tribune,100,Michael Wilmington,"Moore's best movie, and one of the most blisteringly effective polemics and documentaries ever.",
BOWLING FOR COLUMBINE,2002,Michael Moore,Rolling Stone,100,Peter Travers,This volcanically funny and seriously scary look at America's obsession with guns is meant to shake us up good. And it does.,
BOWLING FOR COLUMBINE,2002,Michael Moore,Time,90,Richard Corliss,"Rambunctious, disturbing, often hilarious new documentary.",
BOWLING FOR COLUMBINE,2002,Michael Moore,Variety,90,Lisa Nesselson,"The sparks fly thanks to Moore's patented blend of curveball research, expedient juxtaposition, genuine satire and bottomless chutzpah.",
BOWLING FOR COLUMBINE,2002,Michael Moore,ReelViews,88,James Berardinelli,"Imperfect as it may be, Bowling for Columbine is riveting stuff.",
BOWLING FOR COLUMBINE,2002,Michael Moore,Chicago Sun-Times,88,Roger Ebert,Both hilarious and sorrowful.,
BOWLING FOR COLUMBINE,2002,Michael Moore,Boston Globe,88,Wesley Morris,Moore's roving essay feels even more urgent now than it did when the jury had to make up an award to honor it at the Cannes film festival in May.,
BOWLING FOR COLUMBINE,2002,Michael Moore,Miami Herald,88,Rene Rodriguez,"That broad range of subject matter is indicative of the messy, meandering structure of the movie. But if Moore fails to tie this unwieldy movie into a lucid thesis, at least every tangent he chases down has its own payoff.",
BOWLING FOR COLUMBINE,2002,Michael Moore,Portland Oregonian,83,Shawn Levy,"Impressively reframes the gun-control debate in terms that advocates of both sides might find fruitful, but Moore doesn't do anything to shed his reputation as a snot.",
BOWLING FOR COLUMBINE,2002,Michael Moore,The New Yorker,80,David Denby,"When he follows his nose -- say, by tracing his own connections to Eric Harris, one of the Columbine shooters -- he implicates himself in what he hates and fears, and he emerges as a wounded patriot searching for a small measure of clarity.  [28 October 2002, p. 119]",
BOWLING FOR COLUMBINE,2002,Michael Moore,The A.V. Club,80,Nathan Rabin,"Often uproariously funny, even though much of its queasy power comes from its acknowledgment that some matters are too horrifying to be washed away with cheap laughter, or packaged into soundbites.",
BOWLING FOR COLUMBINE,2002,Michael Moore,Charlotte Observer,75,Lawrence Toppman,"At its best, the movie powerfully indicts our violent history. A montage of bloody U.S. interventions in foreign affairs over the last half-century, most overthrowing elected governments we didn't like, left me shaken.",
BOWLING FOR COLUMBINE,2002,Michael Moore,New York Daily News,75,Jami Bernard,"Moore brilliantly unmasks the inanity of the arguments used in the debate over gun control in America. He then undermines himself by leaping into the blame game without supporting his central thesis, that the media is what makes teens like the ones at Columbine turn around and shoot up their schools.",
BOWLING FOR COLUMBINE,2002,Michael Moore,The Globe and Mail (Toronto),75,Rick Groen,"Moore continues another one infinitely more valuable -- the proud line that extends right back to Mark Twain, embracing all those satirists so enamoured with America at its best that they won't stand silent for America at its worst.",
BOWLING FOR COLUMBINE,2002,Michael Moore,Philadelphia Inquirer,75,Carrie Rickey,"Irreverent, provocative and provoking.",
BOWLING FOR COLUMBINE,2002,Michael Moore,Entertainment Weekly,75,Lisa Schwarzbaum,"Even Moore's target ticket-buyers are likely to squirm with concern, unsure of who the real weasels and idiots are in this large, unkempt, rambunctious country of ours.",
BOWLING FOR COLUMBINE,2002,Michael Moore,Christian Science Monitor,75,David Sterritt,"Moore turns the camera on himself too often for comfort, but he provides an eye-opening array of facts and revelations.",
BOWLING FOR COLUMBINE,2002,Michael Moore,Los Angeles Times,70,Kenneth Turan,"Moore's concern about issues is genuine, and his showboating technique is often entertaining. But he is not the most organized person in the world, and there is a scattershot randomness about this film that is both its essence and a source of frustration.",
BOWLING FOR COLUMBINE,2002,Michael Moore,Film Threat,70,Mark A. Altman,"It&#146;s a welcome addition to the national debate, which while not always on the money, is consistently thoughtful, smart and thoroughly satisfying.",
BOWLING FOR COLUMBINE,2002,Michael Moore,The New York Times,70,Dana Stevens,"Disturbing, infuriating and often very funny film.",
BOWLING FOR COLUMBINE,2002,Michael Moore,Chicago Reader,70,Jonathan Rosenbaum,Moore's best film to date is this comic and grimly entertaining reflection on America's gun craziness and why we kill one another.,
BOWLING FOR COLUMBINE,2002,Michael Moore,TV Guide Magazine,70,Ken Fox,It does get K-Mart to pull handgun and assault ammunition from their shelves after two Columbine survivors show up at corporate headquarters with Moore's camera crew in tow and bullets bought for 13 cents apiece at a K-Mart store still embedded in their bodies.,
BOWLING FOR COLUMBINE,2002,Michael Moore,Austin Chronicle,67,Marjorie Baumgarten,"Fun and informative, thoughtful and thought-provoking.",
BOWLING FOR COLUMBINE,2002,Michael Moore,Washington Post,60,Desson Thomson,"Moore provides a rather rambling discourse of causality, which includes racism, white flight and Africanized bees.",
BOWLING FOR COLUMBINE,2002,Michael Moore,Slate,60,David Edelstein,"Something appalling about the way he turns to the camera with a look of sorrow: Michael Moore as a suffering Christ. It's an insult to his own movie, which at its considerable best transcends his thuggish personality.",
BOWLING FOR COLUMBINE,2002,Michael Moore,Washington Post,60,Ann Hornaday,The only thing wrong with Bowling for Columbine is Moore himself.,
BOWLING FOR COLUMBINE,2002,Michael Moore,Seattle Post-Intelligencer,58,William Arnold,"It's vintage Moore: on one level the courageous act of a gutsy journalist, and, on another, a callously unfair and self-serving spectacle that makes Moore seem like a big bully, and puts his audience into the position of a vigilante mob.",
BOWLING FOR COLUMBINE,2002,Michael Moore,Village Voice,50,J. Hoberman,"It's poorly structured, a half-hour too long, and devotedly fixated on the filmmaker's persona.",
BOWLING FOR COLUMBINE,2002,Michael Moore,Baltimore Sun,50,Michael Sragow,Shallow and one-sided.,
BOWLING FOR COLUMBINE,2002,Michael Moore,Dallas Observer,50,Luke Y. Thompson,Where Bowling for Columbine is at its most valuable is in its examination of America's culture of fear as a root cause of gun violence.,
BOWLING FOR COLUMBINE,2002,Michael Moore,L.A. Weekly,50,John Powers,It seems to have been made to delight European intellectuals and anyone else who believes that America is a land of bloodthirsty yet comical barbarians.,
TO A LAND UNKNOWN,2024,Mahdi Fleifel,IndieWire,91,Sophie Monks Kaufman,"To a Land Unknown is a tour-de-force of empathic storytelling, with its genre narrative bursting with an overabundance of humanity.","Jun 5, 2024"
TO A LAND UNKNOWN,2024,Mahdi Fleifel,The Film Verdict,90,Adham Youssef,"Fleifel’s influences are many, from 1970’s Hollywood to Palestinian poetry to American novels, as he readily admits in his interviews, but To A Land Unknown is unique in its brutal realism; a heartbreaking tribute to exiled people.","Jun 5, 2024"
